{
  "schemaVersion": 1,
  "source": {
    "hnId": 50129045,
    "hnUrl": "https://news.ycombinator.com/item?id=50129045",
    "originalUrl": "https://huggingface.co/deepseek-ai/DeepSeek-V4.1-Flash-1017",
    "title": "DeepSeek-v4.1-Flash-1017",
    "author": "theykk",
    "score": 670,
    "commentCount": 570,
    "publishedAt": "2026-10-17T08:21:25.000Z",
    "fetchedAt": "2026-10-18T00:25:20.469Z"
  },
  "generation": {
    "provider": "Weekly Day AI",
    "providerUrl": "https://www.weekly-day.top/",
    "model": "gpt-5.5",
    "generatedAt": "2026-10-18T00:25:20.469Z"
  },
  "post": {
    "slug": "deepseek-v4-1-flash-hn-50129045",
    "date": "2026-10-18",
    "publishedAt": "2026-10-18T00:25:20.469Z",
    "readingTime": 3,
    "category": {
      "zh": "人工智能模型",
      "en": "AI Models"
    },
    "tags": {
      "zh": [
        "DeepSeek V4.1 Flash-1017",
        "DeepSeek",
        "多模态模型",
        "KV缓存压缩",
        "Hugging Face"
      ],
      "en": [
        "DeepSeek V4.1 Flash-1017",
        "DeepSeek",
        "multimodal model",
        "KV cache compression",
        "Hugging Face"
      ]
    },
    "title": {
      "zh": "DeepSeek V4.1 Flash-1017 发布",
      "en": "DeepSeek V4.1 Flash-1017 Released"
    },
    "excerpt": {
      "zh": "DeepSeek V4.1 Flash-1017 是一次面向推理、编程、智能体和视觉任务的更新，主打更短执行时间与更低输出成本，但部署门槛仍然很高。",
      "en": "DeepSeek V4.1 Flash-1017 targets reasoning, coding, agents, and vision with shorter execution, but its deployment cost remains substantial."
    },
    "disclosure": {
      "zh": "本文使用星期天AI中转站大模型，基于 Hacker News 内容自动生成。",
      "en": "This article was automatically generated by the Weekly Day AI gateway model using content from Hacker News."
    },
    "content": {
      "zh": [
        {
          "type": "heading",
          "text": {
            "zh": "DeepSeek V4.1 Flash-1017 带来哪些变化",
            "en": "What DeepSeek V4.1 Flash-1017 changes"
          }
        },
        {
          "type": "paragraph",
          "text": {
            "zh": "DeepSeek V4.1 Flash-1017 是 DeepSeek V4.1 Flash 的小版本更新，模型卡称其在推理、编程、智能体任务和视觉基准上均有提升。更新的核心价值不只是分数增加，还包括缩短任务执行时间和减少输出长度，目标是在多个智能体框架中改善性能与成本的平衡。",
            "en": "DeepSeek V4.1 Flash-1017 is a minor update to DeepSeek V4.1 Flash. Its model card reports gains in reasoning, coding, agentic tasks, and visual benchmarks. The stated goal is broader than higher scores: shorter task execution and less output are intended to improve the performance-cost tradeoff across several agent harnesses."
          }
        },
        {
          "type": "heading",
          "text": {
            "zh": "基准结果与开发方式",
            "en": "Benchmarks and development options"
          }
        },
        {
          "type": "paragraph",
          "text": {
            "zh": "在模型卡列出的结果中，新版本在 Terminal-Bench 4.0、DeepSWE v1.1、ProgramBench、NL2Repo-Bench 和多项自动化测试中高于旧版；视觉任务也报告了提升。不过，这些是发布方提供的基准数据，测试框架和工具使用方式会影响结果，不能直接等同于所有实际工作负载的表现。",
            "en": "The listed results show the new release ahead of its predecessor on Terminal-Bench 4.0, DeepSWE v1.1, ProgramBench, NL2Repo-Bench, and several automation tests. It also reports better visual-task scores. These are publisher-provided benchmarks, however, and harness choices and tool access can affect outcomes, so they should not be treated as universal production performance."
          }
        },
        {
          "type": "paragraph",
          "text": {
            "zh": "模型以 MIT 许可证发布，支持 Transformers、vLLM、SGLang 和 Docker Model Runner 等路径，并被标为 image-text-to-text。仓库还提供 Python 编码参考实现，以及带 Python 绑定的 deepseek-recipe，用于处理多轮对话、工具调用、思考模式和交错图像内容。",
            "en": "The model is released under the MIT License and offers paths through Transformers, vLLM, SGLang, and Docker Model Runner. It is labeled image-text-to-text. The repository also includes a Python encoding reference and deepseek-recipe, a Rust toolkit with Python bindings for multi-turn conversations, tool calls, thinking mode, and interleaved image content."
          }
        },
        {
          "type": "heading",
          "text": {
            "zh": "部署门槛仍是关键问题",
            "en": "Deployment remains the key constraint"
          }
        },
        {
          "type": "paragraph",
          "text": {
            "zh": "仓库显示该模型约有 7630 亿参数，权重文件总大小约 510 GB，并建议使用 100 万 token 上下文窗口和至少 26 万 token 的最大输出长度。这种规模使本地运行、显存配置、量化方案和推理吞吐成为现实限制。与此同时，仓库没有提供 Jinja 格式的聊天模板，生产集成需要使用其编码工具或自行完成协议适配。基准优势能否在不同硬件、服务框架和真实代理流程中持续，还需要独立复现与成本数据来回答。",
            "en": "The repository lists roughly 763 billion parameters and about 510 GB of total weight files, with a recommended 1-million-token context window and at least 256K maximum tokens. That scale makes local execution, memory capacity, quantization, and throughput practical constraints. The release also lacks a Jinja-format chat template, so production integrations must use its encoding tools or implement protocol adaptation themselves. Independent reproduction and real cost data are still needed to determine whether the benchmark gains hold across hardware, serving stacks, and agent workflows."
          }
        }
      ],
      "en": [
        {
          "type": "heading",
          "text": {
            "zh": "DeepSeek V4.1 Flash-1017 带来哪些变化",
            "en": "What DeepSeek V4.1 Flash-1017 changes"
          }
        },
        {
          "type": "paragraph",
          "text": {
            "zh": "DeepSeek V4.1 Flash-1017 是 DeepSeek V4.1 Flash 的小版本更新，模型卡称其在推理、编程、智能体任务和视觉基准上均有提升。更新的核心价值不只是分数增加，还包括缩短任务执行时间和减少输出长度，目标是在多个智能体框架中改善性能与成本的平衡。",
            "en": "DeepSeek V4.1 Flash-1017 is a minor update to DeepSeek V4.1 Flash. Its model card reports gains in reasoning, coding, agentic tasks, and visual benchmarks. The stated goal is broader than higher scores: shorter task execution and less output are intended to improve the performance-cost tradeoff across several agent harnesses."
          }
        },
        {
          "type": "heading",
          "text": {
            "zh": "基准结果与开发方式",
            "en": "Benchmarks and development options"
          }
        },
        {
          "type": "paragraph",
          "text": {
            "zh": "在模型卡列出的结果中，新版本在 Terminal-Bench 4.0、DeepSWE v1.1、ProgramBench、NL2Repo-Bench 和多项自动化测试中高于旧版；视觉任务也报告了提升。不过，这些是发布方提供的基准数据，测试框架和工具使用方式会影响结果，不能直接等同于所有实际工作负载的表现。",
            "en": "The listed results show the new release ahead of its predecessor on Terminal-Bench 4.0, DeepSWE v1.1, ProgramBench, NL2Repo-Bench, and several automation tests. It also reports better visual-task scores. These are publisher-provided benchmarks, however, and harness choices and tool access can affect outcomes, so they should not be treated as universal production performance."
          }
        },
        {
          "type": "paragraph",
          "text": {
            "zh": "模型以 MIT 许可证发布，支持 Transformers、vLLM、SGLang 和 Docker Model Runner 等路径，并被标为 image-text-to-text。仓库还提供 Python 编码参考实现，以及带 Python 绑定的 deepseek-recipe，用于处理多轮对话、工具调用、思考模式和交错图像内容。",
            "en": "The model is released under the MIT License and offers paths through Transformers, vLLM, SGLang, and Docker Model Runner. It is labeled image-text-to-text. The repository also includes a Python encoding reference and deepseek-recipe, a Rust toolkit with Python bindings for multi-turn conversations, tool calls, thinking mode, and interleaved image content."
          }
        },
        {
          "type": "heading",
          "text": {
            "zh": "部署门槛仍是关键问题",
            "en": "Deployment remains the key constraint"
          }
        },
        {
          "type": "paragraph",
          "text": {
            "zh": "仓库显示该模型约有 7630 亿参数，权重文件总大小约 510 GB，并建议使用 100 万 token 上下文窗口和至少 26 万 token 的最大输出长度。这种规模使本地运行、显存配置、量化方案和推理吞吐成为现实限制。与此同时，仓库没有提供 Jinja 格式的聊天模板，生产集成需要使用其编码工具或自行完成协议适配。基准优势能否在不同硬件、服务框架和真实代理流程中持续，还需要独立复现与成本数据来回答。",
            "en": "The repository lists roughly 763 billion parameters and about 510 GB of total weight files, with a recommended 1-million-token context window and at least 256K maximum tokens. That scale makes local execution, memory capacity, quantization, and throughput practical constraints. The release also lacks a Jinja-format chat template, so production integrations must use its encoding tools or implement protocol adaptation themselves. Independent reproduction and real cost data are still needed to determine whether the benchmark gains hold across hardware, serving stacks, and agent workflows."
          }
        }
      ]
    }
  }
}
