{
  "schemaVersion": 1,
  "source": {
    "hnId": 49896586,
    "hnUrl": "https://news.ycombinator.com/item?id=49896586",
    "originalUrl": "https://openai.com/index/introducing-gpt-6-1-sol/",
    "title": "GPT 6.1 Sol: Near-Astra intelligence for a fifth of the price",
    "author": "crorella",
    "score": 783,
    "commentCount": 728,
    "publishedAt": "2026-09-29T17:06:45.000Z",
    "fetchedAt": "2026-09-30T01:37:47.508Z"
  },
  "generation": {
    "provider": "Weekly Day AI",
    "providerUrl": "https://www.weekly-day.top/",
    "model": "gpt-5.5",
    "generatedAt": "2026-09-30T01:37:47.508Z"
  },
  "post": {
    "slug": "gpt-6-1-sol-claims-hn-49896586",
    "date": "2026-09-30",
    "publishedAt": "2026-09-30T01:37:47.508Z",
    "readingTime": 3,
    "category": {
      "zh": "人工智能",
      "en": "Artificial Intelligence"
    },
    "tags": {
      "zh": [
        "GPT-6.1 Sol",
        "Astra",
        "大语言模型",
        "模型定价"
      ],
      "en": [
        "GPT-6.1 Sol",
        "Astra",
        "large language models",
        "AI pricing"
      ]
    },
    "title": {
      "zh": "GPT-6.1 Sol：价格与能力宣称待核实",
      "en": "GPT-6.1 Sol: Claims Await Verification"
    },
    "excerpt": {
      "zh": "GPT-6.1 Sol的标题宣称接近Astra智能且价格仅为其五分之一，但原文不可用，能力、价格与比较基准目前都无法独立核实。",
      "en": "GPT-6.1 Sol is presented as near-Astra intelligence at one-fifth the price, but the unavailable source leaves its capabilities, pricing, and benchmark unverified."
    },
    "disclosure": {
      "zh": "本文使用星期天AI中转站大模型，基于 Hacker News 内容自动生成。",
      "en": "This article was automatically generated by the Weekly Day AI gateway model using content from Hacker News."
    },
    "content": {
      "zh": [
        {
          "type": "heading",
          "text": {
            "zh": "GPT-6.1 Sol的核心宣称",
            "en": "The Core Claim About GPT-6.1 Sol"
          }
        },
        {
          "type": "paragraph",
          "text": {
            "zh": "GPT-6.1 Sol是这则消息的主要关键词。根据现有来源元数据，文章标题将它描述为接近“Astra”级别的智能，同时声称价格约为后者的五分之一。不过，原始文章正文未能提供，因此这些内容目前只能视为标题中的待核实宣称，而不是已经确认的产品事实。",
            "en": "GPT-6.1 Sol is the central keyword in this story. The available source metadata presents it as offering intelligence close to “Astra” while claiming a price of about one-fifth of that reference. However, the original article text was unavailable, so these points should be treated as unverified claims from a headline, not as confirmed product facts."
          }
        },
        {
          "type": "heading",
          "text": {
            "zh": "社区关注反映了什么",
            "en": "What the Community Response Indicates"
          }
        },
        {
          "type": "paragraph",
          "text": {
            "zh": "这条Hacker News消息发表于2026年9月29日，页面记录了783分和728条评论，说明它在社区中获得了显著关注。这样的互动量可以说明话题具有讨论价值，但不能证明模型已经达到某种能力水平，也不能证明其价格优势真实存在。评分与评论数量更适合作为兴趣信号，而非性能或商业结论。",
            "en": "The Hacker News story was published on September 29, 2026, and its page recorded a score of 783 with 728 comments, indicating substantial community attention. That level of engagement shows that the topic attracted discussion, but it does not establish a particular capability level or confirm a pricing advantage. Scores and comment counts are better understood as signals of interest than as evidence of technical or commercial performance."
          }
        },
        {
          "type": "heading",
          "text": {
            "zh": "仍需核实的关键问题",
            "en": "The Questions Still Requiring Verification"
          }
        },
        {
          "type": "paragraph",
          "text": {
            "zh": "最重要的开放问题是“Astra”具体指什么，以及“接近智能”采用了哪些可重复的评测标准。还需要知道五分之一的价格对应输入、输出、订阅还是其他计费单位，是否包含速率限制、上下文长度和使用配额。没有原文、官方定价表或基准结果，读者无法公平比较GPT-6.1 Sol与其他模型。",
            "en": "The main open question is what “Astra” refers to and which reproducible evaluations support the phrase “near” its intelligence. It is also necessary to know whether one-fifth of the price refers to input tokens, output tokens, a subscription, or another billing unit, and whether limits on rate, context, or usage apply. Without the article text, an official pricing table, or benchmark results, readers cannot fairly compare GPT-6.1 Sol with other models."
          }
        },
        {
          "type": "paragraph",
          "text": {
            "zh": "因此，现阶段最稳妥的结论是：GPT-6.1 Sol已经成为一个受到关注的名称，但其能力和成本优势尚未由所提供的来源得到验证。后续判断应优先依赖完整原文、透明的评测方法、明确的价格条件，以及可由第三方复现的结果。",
            "en": "The most defensible conclusion for now is that GPT-6.1 Sol has become a closely watched name, while its claimed capability and cost advantages remain unsupported by the supplied source. Further judgment should rely on the full article, transparent evaluation methods, explicit pricing terms, and results that independent parties can reproduce."
          }
        }
      ],
      "en": [
        {
          "type": "heading",
          "text": {
            "zh": "GPT-6.1 Sol的核心宣称",
            "en": "The Core Claim About GPT-6.1 Sol"
          }
        },
        {
          "type": "paragraph",
          "text": {
            "zh": "GPT-6.1 Sol是这则消息的主要关键词。根据现有来源元数据，文章标题将它描述为接近“Astra”级别的智能，同时声称价格约为后者的五分之一。不过，原始文章正文未能提供，因此这些内容目前只能视为标题中的待核实宣称，而不是已经确认的产品事实。",
            "en": "GPT-6.1 Sol is the central keyword in this story. The available source metadata presents it as offering intelligence close to “Astra” while claiming a price of about one-fifth of that reference. However, the original article text was unavailable, so these points should be treated as unverified claims from a headline, not as confirmed product facts."
          }
        },
        {
          "type": "heading",
          "text": {
            "zh": "社区关注反映了什么",
            "en": "What the Community Response Indicates"
          }
        },
        {
          "type": "paragraph",
          "text": {
            "zh": "这条Hacker News消息发表于2026年9月29日，页面记录了783分和728条评论，说明它在社区中获得了显著关注。这样的互动量可以说明话题具有讨论价值，但不能证明模型已经达到某种能力水平，也不能证明其价格优势真实存在。评分与评论数量更适合作为兴趣信号，而非性能或商业结论。",
            "en": "The Hacker News story was published on September 29, 2026, and its page recorded a score of 783 with 728 comments, indicating substantial community attention. That level of engagement shows that the topic attracted discussion, but it does not establish a particular capability level or confirm a pricing advantage. Scores and comment counts are better understood as signals of interest than as evidence of technical or commercial performance."
          }
        },
        {
          "type": "heading",
          "text": {
            "zh": "仍需核实的关键问题",
            "en": "The Questions Still Requiring Verification"
          }
        },
        {
          "type": "paragraph",
          "text": {
            "zh": "最重要的开放问题是“Astra”具体指什么，以及“接近智能”采用了哪些可重复的评测标准。还需要知道五分之一的价格对应输入、输出、订阅还是其他计费单位，是否包含速率限制、上下文长度和使用配额。没有原文、官方定价表或基准结果，读者无法公平比较GPT-6.1 Sol与其他模型。",
            "en": "The main open question is what “Astra” refers to and which reproducible evaluations support the phrase “near” its intelligence. It is also necessary to know whether one-fifth of the price refers to input tokens, output tokens, a subscription, or another billing unit, and whether limits on rate, context, or usage apply. Without the article text, an official pricing table, or benchmark results, readers cannot fairly compare GPT-6.1 Sol with other models."
          }
        },
        {
          "type": "paragraph",
          "text": {
            "zh": "因此，现阶段最稳妥的结论是：GPT-6.1 Sol已经成为一个受到关注的名称，但其能力和成本优势尚未由所提供的来源得到验证。后续判断应优先依赖完整原文、透明的评测方法、明确的价格条件，以及可由第三方复现的结果。",
            "en": "The most defensible conclusion for now is that GPT-6.1 Sol has become a closely watched name, while its claimed capability and cost advantages remain unsupported by the supplied source. Further judgment should rely on the full article, transparent evaluation methods, explicit pricing terms, and results that independent parties can reproduce."
          }
        }
      ]
    }
  }
}
